{
  "schemaVersion": 1,
  "dependencyId": "wiserr-growth-snapshot-v1",
  "system": "WISERR_OS",
  "repository": "mottadavid/Wiserr-OS",
  "contractName": "wiserr-growth-snapshot",
  "contractVersion": "1",
  "status": "CANDIDATE",
  "validatedCommitSha": "5e7e24511b53dcf73d2f8cbe590549e5165046a6",
  "authorityFingerprint": "5682a8ce6223466f7f391929d5957515fef34c918cacc52a202041324f2c1588",
  "validatedAt": "2026-08-19T04:05:14.000Z",
  "validUntil": null,
  "guardedPaths": [
    "server/growth/growthSnapshotService.ts",
    "tests/growth/growthSnapshotService.test.ts",
    "docs/growth/GROWTHOS_READ_CONTRACT.md"
  ],
  "capabilities": {
    "aggregateGrowthSnapshotProducer": true,
    "readGrowthSnapshot": false,
    "reactivationSmsExecution": false,
    "reactivationEmailExecution": false,
    "lunaCampaignContext": false,
    "canonicalBookingOutcomeEvents": false,
    "canonicalWonRevenueOutcomeEvents": false
  },
  "evidence": [
    {
      "kind": "GITHUB_PR",
      "reference": "mottadavid/Wiserr-OS#1725",
      "summary": "Fresh current-base draft producer/domain slice for aggregate GrowthOS planning state; not mounted as a certified read API."
    },
    {
      "kind": "AUTHORITY_AUDIT",
      "reference": "server/stores/postgres/postgresLeadStore.ts",
      "summary": "Wiserr remains authoritative for lead identity, stage, per-channel opt-outs, and global do-not-contact state."
    },
    {
      "kind": "AUTHORITY_AUDIT",
      "reference": "server/messaging/sendTenantSms.ts",
      "summary": "Wiserr remains the sole blessed outbound SMS authority; existing purposes do not certify GrowthOS marketing reactivation."
    }
  ],
  "notes": "Candidate only. The current upstream slice defines the aggregate producer but has no mounted GrowthOS read surface. GrowthOS must not require readGrowthSnapshot or any execution capability from this receipt until the producer is merged, an authenticated read boundary is separately merged/tested, the mounted semantic basis is re-fingerprinted, and the dependency is promoted to CERTIFIED. Operational capacity remains external to this producer and must come from a separately authorized capacity source."
}
